<?xml version="1.0"?>
<!DOCTYPE emulator SYSTEM "../../../dtd/caesar.dtd">
<emulator id="namco_history_vol_1" type="commercial" dat="Namco_History_Vol_1">
	<name>Namco History Vol 1</name>
	<version>-</version>
	<date>1997</date>

	<homepage>http://www.namco.co.jp/home/cs/pc/nh_vol1/</homepage>
	<author_link id="namco">&author_namco;</author_link>

	<emulates>Mappy, Xevious, Super Xevious, Toypop, Motos</emulates>
	<comment>Fully playable demos of Mappy and Xevious are available below. Very good emulation, includes ROMs and is freeware.</comment>
	<status>Released</status>

	<platform>Windows</platform>

	<controllers>
		<controller>Keyboard</controller>
	</controllers>

	<features>
		<sound>Yes</sound>
		<source>No</source>
		<screendump>No</screendump>
		<hiscoresave>No</hiscoresave>
		<savegame>No</savegame>
		<recordinput>No</recordinput>
		<dips>No</dips>
		<cheat>No</cheat>
		<autoframeskip>No</autoframeskip>
		<throttle>Yes</throttle>
	</features>

	<files>
		<file name="mappy95.zip">Mappy Emulator (inbuilt ROMs)</file>
		<file name="xevious95.zip">Xevious Emulator (inbuilt ROMs)</file>
	</files>
</emulator>
