<?xml version="1.0"?>
<!DOCTYPE emulator SYSTEM "../../../dtd/caesar.dtd">
<emulator id="namco_museum_64" type="n64" dat="Namco_Museum_64">
	<name>Namco Museum 64</name>
	<version>-</version>
	<date>1999</date>

	<homepage>http://www.namco.com/</homepage>
	<author_link id="namco">&author_namco;</author_link>

	<emulates>Galaga, Pac-Man, Pole Position, Galaxian, Dig Dug, Ms Pac-Man</emulates>
	<comment>A selection of classic games from Namco plus related information.</comment>
	<status>Released</status>

	<platform>N64</platform>

	<controllers>
		<controller>Joypad</controller>
	</controllers>

	<features>
		<sound>Yes</sound>
		<source>No</source>
		<screendump>No</screendump>
		<hiscoresave>Yes</hiscoresave>
		<savegame>No</savegame>
		<recordinput>No</recordinput>
		<dips>Yes</dips>
		<cheat>No</cheat>
		<autoframeskip>No</autoframeskip>
		<throttle>Yes</throttle>
		<rotate>Yes</rotate>
	</features>
</emulator>
