<?xml version="1.0"?>
<!DOCTYPE emulator SYSTEM "../../../dtd/caesar.dtd">
<emulator id="yiear" type="mac" dat="Yie_Ar_Kung_Fu">
	<name>Yie Ar Kung Fu</name>
	<version>1.0</version>
	<date>09/11/1997</date>

	<homepage status="none"></homepage>
	<author_link id="phil_stroffolino">&author_phil_stroffolino;</author_link>

	<emulates>Yie Ar Kung Fu</emulates>
	<comment>This emulator perfectly plays the classic fighting arcade game, Yie Ar Kung-Fu. This emulator is fast even on slower machines. It perfectly renders the original graphics, except for a difference in a color here or there, and plays back all the sounds 100 percent true to the original.</comment>
	<status>Discontinued</status>

	<platform>Mac</platform>

	<controllers>
		<controller>Keyboard</controller>
	</controllers>

	<features>
		<sound>Yes</sound>
		<source>No</source>
		<screendump>No</screendump>
		<hiscoresave>No</hiscoresave>
		<savegame>No</savegame>
		<recordinput>No</recordinput>
		<dips>Yes</dips>
		<cheat>No</cheat>
		<autoframeskip>No</autoframeskip>
		<throttle>Yes</throttle>
		<network>No</network>
		<recordsound>No</recordsound>
		<rotate>No</rotate>
	</features>

	<files>
		<file name="yakf.cpt.Hqx">Emulator (hqx)</file>
		<file name="YieAr.sit">Emulator (stuffit)</file>
	</files>
</emulator>
