<?xml version="1.0"?>
<!DOCTYPE emulator SYSTEM "../../../dtd/caesar.dtd">
<emulator id="laser" type="multi" dat="Laser_v0.20a">
	<name>Laser (Lopantu's Arcade System Emulator)</name>
	<version>0.20</version>
	<date>30/07/2002</date>

	<homepage>http://laser.sourceforge.net/</homepage>
	<homepage>http://www.emucamp.com/laser/</homepage>
	<author_link id="lopantu">&author_lopantu;</author_link>

	<emulates>Midway 8080 based games like space invaders</emulates>
	<comment>Based on Sinvader by Mike Green</comment>
	<status>Dormant</status>

	<cpu_links>
		<library_link id="z80" type="cpu">&library_z80;</library_link>
		<library_link id="m6502" type="cpu">&library_m6502;</library_link>
	</cpu_links>

	<tool_links>
		<tool_link id="djgpp" type="compilers">&tool_djgpp;</tool_link>
		<tool_link id="allegro" type="gfx_libs">&tool_allegro;</tool_link>
	</tool_links>

	<platform>DOS</platform>

	<controllers>
		<controller>Keyboard</controller>
		<controller>Joystick</controller>
	</controllers>

	<features>
		<sound>Yes</sound>
		<source>Yes</source>
		<screendump>No</screendump>
		<hiscoresave>No</hiscoresave>
		<savegame>Yes</savegame>
		<recordinput>No</recordinput>
		<dips>No</dips>
		<cheat>No</cheat>
		<autoframeskip>No</autoframeskip>
		<throttle>Yes</throttle>
		<rotate>No</rotate>
	</features>

	<files>
		<file name="laser020.zip">DOS Binary for Laser</file>
		<file name="laser020s.zip">DOS Source for Laser</file>
	</files>
	
	<relatives>
		<predecessors>
			<emulator_link id="sinvader" type="single">&emulator_sinvader;</emulator_link>
		</predecessors>

		<ports>
			<emulator_link id="laser32" type="multi2">&emulator_laser32;</emulator_link>
			<emulator_link id="belaser" type="beos">&emulator_belaser;</emulator_link>
			<emulator_link id="laser_ipaq" type="wince">&emulator_laser_ipaq;</emulator_link>
			<emulator_link id="laser_linux" type="linux">&emulator_laser_linux;</emulator_link>
			<emulator_link id="laserdc" type="dreamcast">&emulator_laserdc;</emulator_link>
			<emulator_link id="laser_sdl" type="multi2">&emulator_laser_sdl;</emulator_link>
		</ports>
	</relatives>
</emulator>
