<?xml version="1.0"?>
<!DOCTYPE emulator SYSTEM "../../../dtd/caesar.dtd">
<emulator id="retrocade_os2" type="os2" dat="Retrocade_Alpha_5" dat_type="extra">
	<name>Retrocade (OS/2)</name>
	<version>Alpha 5</version>
	<date>20/08/2000</date>

	<homepage status="bad">http://emuos2.vintagegaming.com/</homepage>
	<author_link id="martin_amodeo">&author_martin_amodeo;</author_link>

	<emulates>Over 100 Classics (Late 70's to mid/late 80's)</emulates>
	<comment>Nice interface but everything is covered by MAME</comment>
	<status>Dormant</status>

	<cpu_links>
		<library_link id="mathbox" type="cpu">&library_mathbox;</library_link>
		<library_link id="multi6502" type="cpu">&library_multi6502;</library_link>
		<library_link id="multi6808" type="cpu">&library_multi6808;</library_link>
		<library_link id="multi6809" type="cpu">&library_multi6809;</library_link>
		<library_link id="multiz80" type="cpu">&library_multiz80;</library_link>
		<library_link id="starscream" type="cpu">&library_starscream;</library_link>
	</cpu_links>

	<tool_links>
		<tool_link id="zlib" type="zip_libs">&tool_zlib;</tool_link>
	</tool_links>

	<platform>OS/2</platform>

	<controllers>
		<controller>Keyboard</controller>
		<controller>Joystick</controller>
		<controller>Mouse</controller>
	</controllers>

	<features>
		<sound>Yes</sound>
		<source>No</source>
		<screendump>Yes</screendump>
		<hiscoresave>Yes</hiscoresave>
		<savegame>Yes</savegame>
		<recordinput>Yes</recordinput>
		<dips>Yes</dips>
		<cheat>No</cheat>
		<autoframeskip>No</autoframeskip>
		<throttle>Yes</throttle>
		<network>No</network>
		<recordsound>No</recordsound>
		<rotate>No</rotate>
	</features>

	<files>
		<file name="retro_alpha5.zip">Emulator</file>
	</files>

	<relatives>
		<port_of>
			<emulator_link id="retrocade" type="multi">&emulator_retrocade;</emulator_link>
		</port_of>
	</relatives>
</emulator>
