<?xml version="1.0"?>
<!DOCTYPE emulator SYSTEM "../../../dtd/caesar.dtd">
<emulator id="xcade_unix" type="linux" dat="Xcade_v0.85">
	<name>Xcade (Unix)</name>
	<version>0.85</version>
	<date>25/04/1997</date>

	<homepage status="none"></homepage>
	<author_link id="jeff_mitchell">&author_jeff_mitchell;</author_link>

	<contributors>
		<contributor>
			<author_link id="maximum_entropy">&author_maximum_entropy;</author_link>
			<comment>Patches for Space Invaders Deluxe and Lunar Rescue</comment>
		</contributor>
	</contributors>

	<emulates>Classics like Phoenix, Donkey Kong, Pac-Man and Space Invaders</emulates>
	<comment></comment>
	<status>Dormant</status>

	<platform>Linux</platform>

	<controllers>
		<controller>Keyboard</controller>
	</controllers>

	<features>
		<sound>No</sound>
		<source>No</source>
		<screendump>No</screendump>
		<hiscoresave>No</hiscoresave>
		<savegame>No</savegame>
		<recordinput>No</recordinput>
		<dips>No</dips>
		<cheat>No</cheat>
		<autoframeskip>No</autoframeskip>
		<throttle>Yes</throttle>
		<network>No</network>
	</features>

	<files>
		<file name="xcade085_fixed.tgz">Emulator (fixed archive, many on the web are corrupt)</file>
	</files>

	<relatives>
		<ports>
			<emulator_link id="xcade" type="multi">&emulator_xcade;</emulator_link>
			<emulator_link id="xcade_palmos" type="palmos">&emulator_xcade_palmos;</emulator_link>
		</ports>
	</relatives>
</emulator>
