<?xml version="1.0"?>
<!DOCTYPE emulator SYSTEM "../../../dtd/caesar.dtd">
<emulator id="rockulator_orig" type="multi" dat="Rock-ulator_v0.86">
	<name>Rockulator</name>
	<version>0.86</version>
	<date>29/04/1997</date>

	<homepage status="none"></homepage>
	<author_link id="brian_levine">&author_brian_levine;</author_link>

	<contributors>
		<contributor>
			<author_link id="ivan_mackintosh">&author_ivan_mackintosh;</author_link>
			<comment>Original Vanguard Emulator (v0.1)</comment>
		</contributor>
		<contributor>
			<author_link id="allard_van_der_bas">&author_allard_van_der_bas;</author_link>
			<comment>Ported the Vanguard Emulator to GCC (v0.2)</comment>
		</contributor>
		<contributor>
			<author_link id="martin_scragg">&author_martin_scragg;</author_link>
			<comment>Memory map, schematics and assorted help</comment>
		</contributor>
	</contributors>

	<emulates>Vanguard, Fantasy, Nibbler (all SNK)</emulates>
	<comment>Started life as the Vanguard Emulator by Ivan Mackintosh. Ported to GCC by Allard van der Bas then continued by Brian. Re-written in C++ to become Rockulator++.</comment>
	<status>Superceded</status>

	<cpu_links>
		<library_link id="multi6502" type="cpu">&library_multi6502;</library_link>
	</cpu_links>

	<tool_links>
		<tool_link id="djgpp" type="compilers">&tool_djgpp;</tool_link>
		<tool_link id="allegro" type="gfx_libs">&tool_allegro;</tool_link>
	</tool_links>

	<platform>DOS</platform>

	<controllers>
		<controller>Keyboard</controller>
		<controller>Joystick</controller>
	</controllers>

	<features>
		<sound>Partial</sound>
		<source>Yes</source>
		<screendump>Yes</screendump>
		<hiscoresave>Yes</hiscoresave>
		<savegame>Yes</savegame>
		<recordinput>No</recordinput>
		<dips>No</dips>
		<cheat>No</cheat>
		<autoframeskip>No</autoframeskip>
		<throttle>Yes</throttle>
		<network>No</network>
		<recordsound>No</recordsound>
		<rotate>No</rotate>
	</features>

	<files>
		<file name="Rockulator V0.86 [Dos].zip">Emulator v0.086</file>
	</files>

	<relatives>
		<successors>
			<emulator_link id="rockulator" type="multi">&emulator_rockulator;</emulator_link>
		</successors>
	</relatives>
</emulator>
