<?xml version="1.0"?>
<!DOCTYPE author SYSTEM "../../dtd/caesar.dtd">
<author id="hasbro_interactive">
	<name>Hasbro Interactive</name>
	<email>customer_support@hasbro.com</email>
	<emulator_links>
		<emulator_link id="atari_arcade_hits_1" type="commercial">&emulator_atari_arcade_hits_1;</emulator_link>
		<emulator_link id="atari_arcade_hits_2" type="commercial">&emulator_atari_arcade_hits_2;</emulator_link>
		<emulator_link id="centipede_classic_mode" type="commercial">&emulator_centipede_classic_mode;</emulator_link>
		<emulator_link id="centipede_classic_mode_dc" type="dreamcast">&emulator_centipede_classic_mode_dc;</emulator_link>
		<emulator_link id="qbert_classic_mode" type="commercial">&emulator_qbert_classic_mode;</emulator_link>
		<emulator_link id="qbert_classic_mode_psx" type="psx">&emulator_qbert_classic_mode_psx;</emulator_link>
		<emulator_link id="qbert_classic_mode_dc" type="dreamcast">&emulator_qbert_classic_mode_dc;</emulator_link>
	</emulator_links>
</author>
