<?xml version="1.0"?>
<!DOCTYPE emulator SYSTEM "../../../dtd/caesar.dtd">
<emulator id="finalburn" type="multi" dat="Final_Burn_v0.518">
	<name>Final Burn</name>
	<version>0.518</version>
	<date>14/10/2002</date>

	<homepage>http://www.finalburn.com/</homepage>
	<author_link id="dave_dtmnt">&author_dave_dtmnt;</author_link>

	<emulates>Sega and Capcom 68000 games</emulates>
	<comment>Originally called the 'After Burner Emulator', Final Burn soon added support for other Sega games on similar hardware. In addition to those it has also started supporting CPS-2 games and a few of the CPS-1 games.</comment>
	<status>Dormant</status>

	<cpu_links>
		<library_link id="doze" type="cpu">&library_doze;</library_link>
		<library_link id="a68k" type="cpu">&library_a68k;</library_link>
	</cpu_links>

	<tool_links>
		<tool_link id="msvc" type="compilers">&tool_msvc;</tool_link>
		<tool_link id="zlib" type="zip_libs">&tool_zlib;</tool_link>
	</tool_links>

	<platform>Windows</platform>

	<controllers>
		<controller>Keyboard</controller>
		<controller>Joystick</controller>
	</controllers>

	<features>
		<sound>Yes</sound>
		<source>Yes</source>
		<screendump>No</screendump>
		<hiscoresave>No</hiscoresave>
		<savegame>Yes</savegame>
		<recordinput>No</recordinput>
		<dips>Yes</dips>
		<cheat>No</cheat>
		<autoframeskip>Yes</autoframeskip>
		<throttle>Yes</throttle>
	</features>

	<files>
		<file name="fbn_0518.zip">Emulator</file>
		<file name="burn_0517.zip">Source v0.517 (Burn Library)</file>
		<file name="burner_0517.zip">Source v0.517 (GUI)</file>
	</files>

	<relatives>
		<ports>
			<emulator_link id="finalburn_linux" type="linux">&emulator_finalburn_linux;</emulator_link>
			<emulator_link id="finalburn_qnx" type="qnx">&emulator_finalburn_qnx;</emulator_link>
			<emulator_link id="finalburn_beos" type="beos">&emulator_finalburn_beos;</emulator_link>
		</ports>

		<successors>
			<emulator_link id="finalburnalpha" type="multi">&emulator_finalburnalpha;</emulator_link>
		</successors>
	</relatives>
</emulator>
