<?xml version="1.0"?>
<!DOCTYPE emulator SYSTEM "../../../dtd/caesar.dtd">
<emulator id="cpse" type="sound" dat="CPSE_v0.02">
	<name>CPSE</name>
	<version>0.02</version>
	<date>19/11/2001</date>

	<homepage>http://cpse.emuunlim.com/</homepage>
	<author_link id="cesar_nicolas_gonzalez">&author_cesar_nicolas_gonzalez;</author_link>

	<emulates>QSound music of CPS-2 games</emulates>
	<comment>Plays the music and sound effects from arcade games based on Capcom's CPS-2 hardware. Also contains a sprite viewer and plans to become a full emulator eventually.</comment>
	<status>Dormant</status>

	<platform>DOS</platform>

	<controllers>
		<controller>Keyboard</controller>
	</controllers>

	<features>
		<sound>Yes</sound>
		<source>No</source>
		<screendump>No</screendump>
		<hiscoresave>No</hiscoresave>
		<savegame>No</savegame>
		<recordinput>No</recordinput>
		<dips>No</dips>
		<cheat>No</cheat>
		<autoframeskip>No</autoframeskip>
		<throttle>No</throttle>
		<network>No</network>
		<recordsound>No</recordsound>
		<rotate>No</rotate>
	</features>

	<files>
		<file name="cpse002.zip">Player for DOS</file>
	</files>
</emulator>
