<?xml version="1.0"?>
<!DOCTYPE library SYSTEM "../../../dtd/caesar.dtd">
<library id="turbo68k" type="cpu">
	<name>Turbo68K</name>
	<version>0.60</version>
	<date>19/01/2002</date>

	<homepage>http://dynarec.com/~bart/turbo68k/</homepage>
	<author_link id="bart_trzynadlowski">&author_bart_trzynadlowski;</author_link>

	<emulates>M68000 (Motorola)</emulates>
	<comment>Written in x86 assembler. Previously known as Genital68K. Fast and accurate</comment>

	<emulator_links>
		<emulator_link id="gxp" type="sound">&emulator_gxp;</emulator_link>
	</emulator_links>

	<files>
		<file name="t68k060.zip">CPU Emulator</file>
		<file name="68kdb060.zip">68000 Disassembler for use with Genital68K</file>
	</files>
</library>
