<?xml version="1.0"?>
<!DOCTYPE emulator SYSTEM "../../../dtd/caesar.dtd">
<emulator id="ace" type="multi" dat="ACE_v1.9">
	<name>ACE (Another Capcom Play System Emulator)</name>
	<version>1.9</version>
	<date>24/02/2002</date>

	<homepage>http://ace.emuunlim.com/</homepage>
	<author_link id="rollback">&author_rollback;</author_link>

	<emulates>Capcom CPS-1, CPS-2 and Neo-Geo games</emulates>
	<comment>One of many Capcom/SNK emulators. When the author lost his latest source code in a hard disk crash, he didn't want to continue it any longer.</comment>
	<status>Discontinued</status>

	<cpu_links>
		<library_link id="musashi" type="cpu">&library_musashi;</library_link>
		<library_link id="multiz80" type="cpu">&library_multiz80;</library_link>
	</cpu_links>

	<tool_links>
		<tool_link id="msvc" type="compilers">&tool_msvc;</tool_link>
		<tool_link id="midas" type="snd_libs">&tool_midas;</tool_link>
		<tool_link id="zlib" type="zip_libs">&tool_zlib;</tool_link>
	</tool_links>

	<platform>Windows</platform>

	<controllers>
		<controller>Keyboard</controller>
	</controllers>

	<features>
		<sound>Yes</sound>
		<source>Yes</source>
		<screendump>No</screendump>
		<hiscoresave>No</hiscoresave>
		<savegame>No</savegame>
		<recordinput>No</recordinput>
		<dips>No</dips>
		<cheat>No</cheat>
		<autoframeskip>No</autoframeskip>
		<throttle>Yes</throttle>
	</features>

	<files>
		<file name="ace19.zip">Emulator</file>
		<file name="ace18src.zip">Source</file>
		<file name="sgemf.zip">Super Gem Fighter driver - the last thing released!</file>
	</files>
</emulator>
