<?xml version="1.0"?>
<!DOCTYPE emulator SYSTEM "../../../dtd/caesar.dtd">
<emulator id="annoid" type="single" dat="Annoid_v1.0">
	<name>Annoid</name>
	<version>1.1</version>
	<date>15/11/2000</date>

	<homepage>http://www.ganksoft.com/</homepage>
	<author_link id="brian_peek">&author_brian_peek;</author_link>

	<emulates>Arkanoid (Taito)</emulates>
	<comment>Emulates Arkanoid using the bootleg ROMset.</comment>
	<status>Dormant</status>

	<cpu_links>
		<library_link id="z80em" type="cpu">&library_z80em;</library_link>
	</cpu_links>

	<tool_links>
		<tool_link id="seal" type="snd_libs">&tool_seal;</tool_link>
		<tool_link id="msvc" type="compilers">&tool_msvc;</tool_link>
	</tool_links>

	<platform>Windows</platform>

	<controllers>
		<controller>Keyboard</controller>
		<controller>Mouse</controller>
	</controllers>

	<features>
		<sound>Yes</sound>
		<source>No</source>
		<screendump>No</screendump>
		<hiscoresave>No</hiscoresave>
		<savegame>Yes</savegame>
		<recordinput>No</recordinput>
		<dips>Yes</dips>
		<cheat>Yes</cheat>
		<autoframeskip>No</autoframeskip>
		<throttle>Yes</throttle>
	</features>

	<files>
		<file name="annoid11.zip">Emulator</file>
	</files>
</emulator>
