<?xml version="1.0"?>
<!DOCTYPE emulator SYSTEM "../../../dtd/caesar.dtd">
<emulator id="laser_ipaq" type="wince" dat="dummy">
	<name>Laser (Compaq Ipaq)</name>
	<version>0.9</version>
	<date>30/10/2000</date>

	<homepage>http://www.laseremu.com/</homepage>
	<author_link id="domenico_dato">&author_domenico_dato;</author_link>

	<emulates>Midway 8080 based games like space invaders</emulates>
	<comment>Compaq Ipaq port of Laser</comment>
	<status>Dormant</status>

	<platform>WinCE</platform>

	<controllers>
		<controller>Buttons</controller>
	</controllers>

	<features>
		<sound>No</sound>
		<source>No</source>
		<screendump>No</screendump>
		<hiscoresave>No</hiscoresave>
		<savegame>No</savegame>
		<recordinput>No</recordinput>
		<dips>No</dips>
		<cheat>No</cheat>
		<autoframeskip>No</autoframeskip>
		<throttle>Yes</throttle>
		<rotate>No</rotate>
	</features>

	<relatives>
		<port_of>
			<emulator_link id="laser" type="multi">&emulator_laser;</emulator_link>
		</port_of>
	</relatives>
</emulator>
